{
  "kind": "Ruleset",
  "id": "basic_ruleset",
  "version": 1,
  "spec": {
    "expression": {
      "operator": "OR",
      "operands": [
        {
          "operator": "AND",
          "operands": [
            {
              "operator": "OR",
              "operands": [
                { "ruleRef": "max_failed_attempts","version": 1 },
                { "ruleRef": "max_incorrect_passwords_history_greater_than_three", "version": 1 }
              ]
            },

            { "ruleRef": "within_business_hours", "version": 2 }
          ]
        },
        {
          "ruleRef": "ip_not_blacklisted", "version": 1
        }
      ]
    }
  }
}
