{
  "kind": "Ruleset",
  "id": "nested_multi_layer_ruleset",
  "version": 1,
  "spec": {
    "expression": {
      "operator": "OR",
      "operands": [
        {
          "operator": "AND",
          "operands": [
            {
              "operator": "OR",
              "operands": [
                { "ruleRef": "max_failed_attempts" },
                { "ruleRef": "max_incorrect_passwords_history_greater_than_three" }
              ]
            },

            { "ruleRef": "within_business_hours" }
          ]
        },
        {
          "ruleRef": "ip_not_blacklisted"
        }
      ]
    }
  }
}
