{
  "kind": "Ruleset",
  "id": "nested_ruleset",
  "version": 1,
  "spec": {
    "expression": {
      "operator": "OR",
      "operands": [
        {
          "operator": "AND",
          "operands": [
            { "ruleRef": "max_failed_attempts", "version": 1 },
            { "ruleRef": "within_business_hours", "version": 1 }
          ]
        },
        {
          "ruleRef": "ip_not_blacklisted", "version": 1
        }
      ]
    }
  }
}
